37,Евгения,Сетка оконная,,https://docs.google.com/document/d/1-SPa3FfcHxgUkCKLkneXkJkakMdlu3VXErRNwEiWH-s/edit?usp=sharing,Ребёнок для меня на первом месте. И я стараюсь следовать этому правилу во всём. ,"Для меня важен комфорт ребёнка. А значит — никаких укусов, никакой духоты. Но между открытым окном и безопасностью был выбор. Теперь нет. Все благодаря тому, что в клубе по любви к детями мне подсказали маленькое решение с вайлдберриз, которое даёт мне уверенность, что он спит спокойно.","Далее проводим распаковку продукта, показываем ключевые триггеры","Качественные материалы

Свежий воздух без комаров

Не портит интерьер

Идеальна для дачи и дома

Установка без инструментов",Оставляю артикул — пригодится каждой маме.
38,Евгения,Сетка оконная,,https://docs.google.com/document/d/1-SPa3FfcHxgUkCKLkneXkJkakMdlu3VXErRNwEiWH-s/edit?usp=sharing,,"У нас во дворе мама, которая орёт на всех и курит под нашими окнами. Просишь отойти от окон - отказывается, говорит - ""Я же мама"", и даже сразу как-то стыдно становится, что попросила отойти! К тому же она shower-free, сознательно не моется уже третий год, чтобы сохранить кожу себе и ребёночку. Поэтому над ней постоянно летают огромные мухи, которые часто залетают к нам в квартиру вместе с дымом! Летом это просто ад. Но я нашла на вайлдберриз способ хоть как-то отгородиться. Он работает, и ставится всего за 5 минут.","Далее проводим распаковку продукта, показываем ключевые триггеры","Эффективная защита

Простая установка

Удобство в быту

Использование в разных условиях

Совместимость с любым интерьером",Артикул — в описании
39,Евгения,Сетка оконная,,https://docs.google.com/document/d/1-SPa3FfcHxgUkCKLkneXkJkakMdlu3VXErRNwEiWH-s/edit?usp=sharing,,"Быть мамой и женой - очень тревожно. То ребенок что-то вытворяет, то муж. Когда ты живёшь в тревоге — даже комар, залетевший с улицы, может вызывать дрожь. Я долго боялась спать с открытым окном, даже на проветривание. Сейчас у меня есть защита — пусть и простая, но дающая ощущение контроля. Подсказала подруга, которой комары мешали заниматься йогой. Я сразуже нашла её на вайлдберриз, и заказала.","Далее проводим распаковку продукта, показываем ключевые триггеры","Свежий воздух без комаров

Безопасность и уют

Лёгкость в уходе

Быстрая установка

Подходит для семьи",Артикул в описании —
40,Евгения,Сетка оконная,,https://docs.google.com/document/d/1-SPa3FfcHxgUkCKLkneXkJkakMdlu3VXErRNwEiWH-s/edit?usp=sharing,"А сколько вы тратите на своего мужчину, девочки?","Я вчера заметила, что мужу очень душно, и он, бедный, лежал под вентилятором. А все потому, что в квартиру летят комары, и окно лучше не открывать. И знаете что? Я решила, что пора брать все в свои руки, и нужно сделать ему щедрый подарок, за все годы нашего семейного счастья. Я сама его купила, сама забрала на вайлдберриз, и ему осталось только установить! Рассказываю про подарок...","Далее проводим распаковку продукта, показываем ключевые триггеры","Лёгкий монтаж

Удобство в поездках

Дизайн, который не бросается в глаза

Комфорт без зуда

Подходит под все окна",Артикул — в описании.
41,Евгения,Сетка оконная,,https://docs.google.com/document/d/1-SPa3FfcHxgUkCKLkneXkJkakMdlu3VXErRNwEiWH-s/edit?usp=sharing,,"Я приехала к родителям на лето с ребёнком. Отношения с мамой - это отдельнаябольная тема. ПОстоянно слышу, что я неряха и неправильно веду хозяйство. А у самих дом — это открытые окна и куча комаров. Говорят — ""да мы так всю жизнь жили"", ""что ты выдумываешь"", ""сетка тебе не нужна"". Я купила на вайлдберриз и поставила. Сделала это безз обсуждений, наверное, впервые в своей жизни. Ребёнок спит спокойно, я — тоже.","Далее проводим распаковку продукта, показываем ключевые триггеры","Комфорт в жаркую погоду
Не нужно ставить дополнительные барьеры
Легкая чистка
Подходит даже для нестандартных проемов
Не создает препятствий при входе",Артикул оставила в описании
42,Евгения,Сетка оконная,,https://docs.google.com/document/d/1-SPa3FfcHxgUkCKLkneXkJkakMdlu3VXErRNwEiWH-s/edit?usp=sharing,"Почему все говорят, что родителям обязательно нужно помогать? Я не согласна!","Ладно когда речь о глобальной помощи, но все эти мелочи, о которых они просят.... Когда летом приезжаешь на дачу, начинается: ""Поставь сетку"", ""почини дверь"", ""купи лампочку"". Один раз я решила начать с самого простого. Заказала на вайлдберриз, привезла, установила — без лишних слов. И все удивились, насколько это удобно.","Далее проводим распаковку продукта, показываем ключевые триггеры","Совместима с раздвижными дверями
Можно использовать в арке
Не портит раму
Подходит для лоджий
Выглядит современно",Артикул в описании. Работает — проверено на родителях.
43,Евгения,Сетка оконная,,https://docs.google.com/document/d/1-SPa3FfcHxgUkCKLkneXkJkakMdlu3VXErRNwEiWH-s/edit?usp=sharing,"Я считаю, что домом должна заниматься женщина, а не мужчина","Мой муж классно готовит, но проветривать — всегда моя задача. Ведь ему тоже надо отдыхать, а я не хочу, чтобы он у меня уставал. Так вот, к проветриванию. Лето — это значит комары, мошки, мухи и вечно закрытые окна. Но в этом году все будет по-другому, ведь на вайлдберриз я нашла это!","Далее проводим распаковку продукта, показываем ключевые триггеры","Мягкое закрытие
Плотно прилегает по периметру
Не вызывает дискомфорта при контакте
Эффективна даже в сумерках
Выдерживает частое открытие",Артикул оставила в описании
44,Евгения,Сетка оконная,,https://docs.google.com/document/d/1-SPa3FfcHxgUkCKLkneXkJkakMdlu3VXErRNwEiWH-s/edit?usp=sharing,"А вы знали, что муж тоже может уйти в декрет по уходу за ребенком?","Когда муж остался с ребёнком, я думала — ему будет сложно. Но он справился. Единственное — звонил и спрашивал, чем от комаров защитить дом. Я подсказала то, что и сама использовала долгие годы, пока он пропадал на работе. Он сначала очень сильно удивился этой моей находке на вайлдбериз, а потом сказал: «Слушай, это же гениально!»","Далее проводим распаковку продукта, показываем ключевые триггеры","Сетка легко моется под душем
Плотная, но дышащая ткань
Никаких липких следов
Мгновенная защита
Не требует обслуживания","Артикул — в описании. Работает для всех — и мам, и пап."
45,Евгения,Сетка оконная,,https://docs.google.com/document/d/1-SPa3FfcHxgUkCKLkneXkJkakMdlu3VXErRNwEiWH-s/edit?usp=sharing,Удалёнка - это не настоящая работа?,"Я работаю из дома. И летом проветривание — боль. Открыла окно — залетели комары, начали кричать, что удалёнка - это не настоящая работа. Закрыла — голова болит от жары. А если на зуме хлопаешь по себе, чтобы убить комара — выглядишь, как будто сумасшедшая. Так и мучаюсь, хуже, чем в офисе! Купила на вайлдберриз одну мелочь, поставила и теперь работаю в тишине и с воздухом.","Далее проводим распаковку продукта, показываем ключевые триггеры","Не занимает место на двери
Можно использовать круглый год
Не греется от солнца
Не влияет на климат в помещении
Создает ощущение свободы","Особенно актуально тем, кто работает из дома. Артикул оставила в описании. "
46,Евгения,Сетка оконная,,https://docs.google.com/document/d/1-SPa3FfcHxgUkCKLkneXkJkakMdlu3VXErRNwEiWH-s/edit?usp=sharing,На прошлой работе были тысячи редфлагов.,"Когда на работе начали давить, я взяла паузу. А они отказались платить зарплату! Видите ли, если сотрудник не работает, то и платить ему не надо... Так что я уволилась, и теперь счастлива! Провожу лето дома, отдыхаю, радуюсь теплу. Но с открытыми окнами — невыносимо. Комары, пыль, соседи орут. Я решила, что мне нужно хотя бы одно — тишина и воздух. За 10 минут нашла решение на вайлдберриз, и сразу же заказала.","Далее проводим распаковку продукта, показываем ключевые триггеры","Устраняет храп, 4 размера — под любой нос, Не вызывает раздражений, 15 дней свежего дыхания в одной пачке, Эффективная фиксация",Артикул — в описании.
47,Евгения,Сетка оконная,,https://docs.google.com/document/d/1-SPa3FfcHxgUkCKLkneXkJkakMdlu3VXErRNwEiWH-s/edit?usp=sharing,Хватит уже хейтить людей за выбор материнство!,"Я - мама, и это мой осознанный выбор. И нет, дети совсем не мешают нам жить. У нас дома тишина, книги, вино по вечерам - дети им не мешают, а вот комары - да! Ты их не просила, а они прилетают. Теперь — нет. Нашла одно простое решение на вайлдберриз, и лето стало действительно расслабляющим.","Далее проводим распаковку продукта, показываем ключевые триггеры","Качественные материалы

Свежий воздух без комаров

Не портит интерьер

Идеальна для дачи и дома

Установка без инструментов",Артикул оставляю в описании!
48,Евгения,Сетка оконная,,https://docs.google.com/document/d/1-SPa3FfcHxgUkCKLkneXkJkakMdlu3VXErRNwEiWH-s/edit?usp=sharing,"Считаете, что декрета - это не работа? Еще какая работа!","Первый признак работы - в декрете очень много стресса. Особенно когда не можешь выспаться, потому что ребёнка кусают комары. Я устала мазать укусы, включать фумигаторы. Второй признак работы - за декрет тоже платят зарплату. Поэтому можно тратиться на вайлдберриз, чтобы решить проблему с комарами. Сейчас я просто открываю окно, потому что у меня есть защита, которая работает.","Далее проводим распаковку продукта, показываем ключевые триггеры","Эффективная защита

Простая установка

Удобство в быту

Использование в разных условиях

Совместимость с любым интерьером", Меньше укусов — больше сна. Артикул — в описании.
49,Евгения,Сетка оконная,,https://docs.google.com/document/d/1-SPa3FfcHxgUkCKLkneXkJkakMdlu3VXErRNwEiWH-s/edit?usp=sharing,"Если ты живешь карьерой - значит, ты пустышка?","Вообще с этим не согласна! Я обожаю свою работу, и это делает жизнь более осмысленной. Не понимаю этих мам в декрете - я поспешила вернуться в работу, как только смогла! Если думаете, что я вообще не устаю - я очень устаю на работе. И вечерами мне просто нужно проветрить и лечь. Но жара, духота, комары — мешают спать. Я решила: хватит. Решила себе помочь, поискала решения на вайлдюерриз, и теперь комары мне не мешают.","Далее проводим распаковку продукта, показываем ключевые триггеры","Свежий воздух без комаров

Безопасность и уют

Лёгкость в уходе

Быстрая установка

Подходит для семьи","Артикул оставила в описании - сохраните, чтобы не потерять!"
50,Евгения,Сетка оконная,,https://docs.google.com/document/d/1-SPa3FfcHxgUkCKLkneXkJkakMdlu3VXErRNwEiWH-s/edit?usp=sharing,"Развенчиваю миф об ""успешных блогерах"". Это все только на картинке, я вам как блогер говорю!","С виду у меня порядок. Но внутри — хронический недосып. Я не сплю из-за комаров — нервничаю, мешает их тоненький противный писк, эта отвратительная щекотка от их лапок, ну и конечно зуд от укусов. И от этого никакие свечи не спасают. А вот одна простая находка на вайлдберриз — спасла.","Далее проводим распаковку продукта, показываем ключевые триггеры","Лёгкий монтаж

Удобство в поездках

Дизайн, который не бросается в глаза

Комфорт без зуда

Подходит под все окна",Артикул оставила — просто повесьте. Это кайф.
51,Евгения,Сетка оконная,,https://docs.google.com/document/d/1-SPa3FfcHxgUkCKLkneXkJkakMdlu3VXErRNwEiWH-s/edit?usp=sharing,"Часто слышу недовольство, что студенты и школьники не хотят работать","Вы бы знали, как им сложно приходится - они уже на этапе учебы все выгоревшие! Мой племянник готовится к экзаменам. В комнате — жара, в голове — каша. Окно не открыть — мошки, жуки влетают в комнату и меняют учиться. Но я купила ему на вайлдберриз простую защиту, чтобы дышал и не чесался. Удивился, насколько стало легче, и даже решил найти работу!","Далее проводим распаковку продукта, показываем ключевые триггеры","Устраняет храп, Облегчает заложенность носа, Повышает качество сна, Эффективная фиксация, Не вызывает раздражений",Артикулом поделилась в описании!
52,Евгения,Сетка оконная,,https://docs.google.com/document/d/1-SPa3FfcHxgUkCKLkneXkJkakMdlu3VXErRNwEiWH-s/edit?usp=sharing,"Есть блогерки, дизайнерки, а я, получается, мамка.","Считаю, что такие феминитивы необходимо вводить! Мне неважно, как меня называют. Важно, чтобы дома было комфортно. Чтобы не летали мухи, не зудели комары, и воздух шел, а не духота. Всё просто, как я люблю. И помогает мне в этом находка на вайлдберриз, которую мне показала одна знакомая - кстати, актёрка в известном театре.","Далее проводим распаковку продукта, показываем ключевые триггеры","Водонепроницаемый, Не вызывает раздражений, 4 размера — под любой нос, В коплекте 4 расширителя и 30 пластырей, Повышает качество сна","Теперь тишина, воздух, свобода... Артикулом делюсь в описании!"
53,Татьяна,Сетка дверная,,https://docs.google.com/document/d/1-SPa3FfcHxgUkCKLkneXkJkakMdlu3VXErRNwEiWH-s/edit?usp=sharing,Теперь даже в деревне появились курьеры-самокатчики! ,"Живу в деревне, часто летом оставляю дверь открытой, чтобы впустить ветерок. Но стоит пройти мимо очередному самокатчику на просёлочной дороге — и вместе с шумом улетают мои иллюзии о спокойном вечере. Дело в том, что за ними носятся комары стаями, и как только самокатчик проезжает мимо - они заполоняют дом. Я начала просыпаться в ночи, чешусь, не высыпаюсь. Тогда соседка подсказала мне находку на Вайлдбериз, и я сразу же заказала её. Делюсь с вами!","Далее проводим распаковку продукта, показываем ключевые триггеры","Можно отрегулировать по ширине
Открывается одной рукой
Не мешает декору
Выдерживает многократное использование
Обеспечивает идеальный микроклимат",Забирайте артикул в описании — пусть дверь остаётся барьером против комаров.
54,Татьяна,Сетка дверная,,https://docs.google.com/document/d/1-SPa3FfcHxgUkCKLkneXkJkakMdlu3VXErRNwEiWH-s/edit?usp=sharing,,"У нас по деревне гуляют чужие собаки без поводков: лаят, беспокоят детей! Приходится пригляжывать за их безопасностью, но при этом терпеть укусы комаров, влетающих через открытую дверь. Постоянный зуд, раздражение, ночные пробуждения — это выматывает сильнее любого шума. Рассказала Подруге, и она подсказала мне находку на Вайлдбериз. Я сразу заказала её. Делюсь!","Далее проводим распаковку продукта, показываем ключевые триггеры","Комфорт в жаркую погоду
Не нужно ставить дополнительные барьеры
Легкая чистка
Подходит даже для нестандартных проемов
Не создает препятствий при входе",Артикул в описании — устанавливайте и проветривайте без укусов.
55,Татьяна,Сетка дверная,,https://docs.google.com/document/d/1-SPa3FfcHxgUkCKLkneXkJkakMdlu3VXErRNwEiWH-s/edit?usp=sharing,,"Летом у нас в деревне бабушки собираются на улице разговаривают, смеются. Очень милые! Я люблю общение, но вместе с этим их голоса и дружный гомон привлекают мошек и комаров, и часто они летят  в мой дом через открытую дверь. Каждый вечер я убегаю в комнату, чтобы не сидеть в компании насекомых. Пошла посидеть с ними и последить за комарами - и одна из бабушек мне подсказала находку на Вайлдбериз, и я сразу же заказала её!","Далее проводим распаковку продукта, показываем ключевые триггеры","Совместима с раздвижными дверями
Можно использовать в арке
Не портит раму
Подходит для лоджий
Выглядит современно",Смотрите артикул в описании — проветривайте легко и без укусов.
