56,Татьяна,Сетка дверная,,https://docs.google.com/document/d/1-SPa3FfcHxgUkCKLkneXkJkakMdlu3VXErRNwEiWH-s/edit?usp=sharing,,"Я выросла в деревне и вижу, как некоторые водят малышей на поводке у калитки, чтобы не убежали. Я понимаю тревогу, чуть шаг за порог - и комары тебя съедят. Да и сама постоянно ловлю комаров, когда оставляю дверь открытой, чтобы проветрить. Если вечер с влажным воздухом, все ходим в мошках, а я снова чешусь. Но соседка подсказала мне находку на Вайлдбериз, и я заказала сразу. Делюсь!","Далее проводим распаковку продукта, показываем ключевые триггеры","Мягкое закрытие
Плотно прилегает по периметру
Не вызывает дискомфорта при контакте
Эффективна даже в сумерках
Выдерживает частое открытие",Артикул оставила в описании — берегите семью от насекомых.
57,Татьяна,Сетка дверная,,https://docs.google.com/document/d/1-SPa3FfcHxgUkCKLkneXkJkakMdlu3VXErRNwEiWH-s/edit?usp=sharing,,"В деревне интернет не всегда быстрый, но многие подростки всё равно с айфонами и компьютерами, и поэтому постоянно сидят дома - играют или что-нибудь смотрят. Конечно же, хочется дать им больше свежего воздуха, но я боюсь открыть дверь, потому что за ними моментально залетают комары и мухи. Дети залипают в интеренетах, а я страдаю от комариных укусов. Пошла в сервисный центр эппл, чтобы устранили проблему, и там мне подсказали находку на Вайлдбериз, которую я сразу заказала.","Далее проводим распаковку продукта, показываем ключевые триггеры","Сетка легко моется под душем
Плотная, но дышащая ткань
Никаких липких следов
Мгновенная защита
Не требует обслуживания",Забирайте артикул в описании — проветривайте дом без лишних «гостей».
58,Татьяна,Сетка дверная,,https://docs.google.com/document/d/1-SPa3FfcHxgUkCKLkneXkJkakMdlu3VXErRNwEiWH-s/edit?usp=sharing,,"Мой ребёнок важнее всего, и я хочу, чтобы он бегал босиком по веранде или газончику, а я могла держать дверь открытой, слушать птиц, не волноваться о насекомых. Но лечение укусов и бессонные ночи выматывают: я не могу полноценно заботиться о нём. Подруга подсказала мне находку на Вайлдбериз, и я сразу же заказала её. Делюсь!","Далее проводим распаковку продукта, показываем ключевые триггеры","Не занимает место на двери
Можно использовать круглый год
Не греется от солнца
Не влияет на климат в помещении
Создает ощущение свободы",Артикул — в описании. Дышите свежим летом без укусов.
59,Татьяна,Сетка дверная,,https://docs.google.com/document/d/1-SPa3FfcHxgUkCKLkneXkJkakMdlu3VXErRNwEiWH-s/edit?usp=sharing,,"Я - мама, и как у любой мамы, у меня есть право на спокойный отдых. Летом в деревне хочется впустить ветерок, но он несёт с собой комаров. Это может показаться это мелочью, но я терпела зуд по ночам, пока соседка не подсказала находку на Вайлдбериз, и я заказала сразу. Делюсь!","Далее проводим распаковку продукта, показываем ключевые триггеры","Легко адаптируется под проем
Сохраняет циркуляцию воздуха
Привлекательно выглядит
Простота монтажа
Подходит для использования на лоджии",Смотрите артикул в описании — комфорт и защита для семьи.
60,Татьяна,Сетка дверная,,https://docs.google.com/document/d/1-SPa3FfcHxgUkCKLkneXkJkakMdlu3VXErRNwEiWH-s/edit?usp=sharing,История про абьюз в деревне.,"В деревню тоже дошли рилсы всех этих психологинь, и теперь повсюду слышатся сплетни о чужих семьях и абьюзе. Как же они любят обсуждать чужие проблемы! Но мою проблему никто не обсуждает, ведь она намного проще: открываю дверь вечером, а рой комаров атакует мой покой. Я чувствую беспокойство сильнее любых слухов: ночами не высыпаюсь, утром усталая. Тогда мама подсказала мне находку на Вайлдбериз, и я сразу заказала. Делюсь!","Далее проводим распаковку продукта, показываем ключевые триггеры","Отличный вариант для кухни
Не мешает использовать дверь как обычно
Фиксация без повреждений
Нет острых углов
Совместима с различными материалами дверей",Артикул в описании — защищайте свой уют от насекомых.
61,Татьяна,Сетка дверная,,https://docs.google.com/document/d/1-SPa3FfcHxgUkCKLkneXkJkakMdlu3VXErRNwEiWH-s/edit?usp=sharing,А кто у вас в семье заботится о доме - вы или муж?,"Можно долго спорить, кто должен содержать дом, но когда живешь в деревне, иногда приходится брать все в свои руки. Муж уехал в командировку, и как назло начался сезон комаров! Я поняла, что просто хочу открыть дверь на лето и не стать кормом для комаров, устала бороться фумигаторами и мазями. Так что решила не медлить, и решить проблему сама. Соседка подсказала находку на Вайлдбериз, и я без раздумий заказала. Делюсь с вами!","Далее проводим распаковку продукта, показываем ключевые триггеры","Можно использовать как временное решение
Хорошо сочетается с белыми рамами
Простота транспортировки
Не требует ежедневной чистки
Не шумит при открытии","Артикул — в описании. Лето без укусов реальнее, чем кажется."
62,Татьяна,Сетка дверная,,https://docs.google.com/document/d/1-SPa3FfcHxgUkCKLkneXkJkakMdlu3VXErRNwEiWH-s/edit?usp=sharing,"РОдители привыкли, что все должны делать так же, как они. А у вас так же?","Родители в деревне привыкли к открытым дверям: «Ветерок нужен». Но я плачу от укусов и ночных пробуждений. Каждый их упрёк «что ты выдумываешь» ещё сильнее давит, а комары добавляют зуд и боль. Подружка подсказала мне находку на Вайлдбериз, я заказала сразу. Делюсь!","Далее проводим распаковку продукта, показываем ключевые триггеры","Легко комбинируется с шторами
Можно установить самостоятельно
Надежный барьер от мошкары
Защищает без капель и запахов
Не требует ухода зимой",Артикул в описании — поставьте и докажите: комфорт важнее.
63,Татьяна,Сетка дверная,,https://docs.google.com/document/d/1-SPa3FfcHxgUkCKLkneXkJkakMdlu3VXErRNwEiWH-s/edit?usp=sharing,"Почему люди постоянно спорят с тем, что дети должны помогать родителям? Я вот помогаю, и считаю, что всем бы не помешало так делать.","Летом приезжаю к родителям в деревню, слышу «оставь дверь открытой, свежо же». Но вместе со свежестью лезут комары, а я всё чешусь. Обычно помогала им по дому, и теперь предложила установить находку с вайлдберриз. Мама подсказала мне находку на Вайлдбериз, и я заказала. Делюсь!","Далее проводим распаковку продукта, показываем ключевые триггеры","Безопасна при контакте с кожей
Пропускает ветерок
Ненавязчива и практична
Защита без компромиссов
Можно использовать с дверьми на пружине","Артикул — в описании. Помогите и себе, и им жить без укусов."
64,Татьяна,Сетка дверная,,https://docs.google.com/document/d/1-SPa3FfcHxgUkCKLkneXkJkakMdlu3VXErRNwEiWH-s/edit?usp=sharing,"Как считаете, нормально, если женщина за рулём, а мужчина готовит? А кому избавлять дом от комаров? Детям?","В деревне я езжу на авто, а муж готовит обед. Но ответственность за дом переходит ко мне: кто защитит уют? Я устала слышать споры о ролях, когда настоящая проблема — комары через открытую дверь. Соседка подсказала мне находку на Вайлдбериз, и я сразу её заказала.","Далее проводим распаковку продукта, показываем ключевые триггеры","Полностью закрывает дверной проем
Прочная сетка
Приятный внешний вид
Обеспечивает защиту с первого дня
Доступная альтернатива дорогим системам",Забирайте артикул в описании — защищайте свой дом от насекомых.
65,Татьяна,Сетка дверная,,https://docs.google.com/document/d/1-SPa3FfcHxgUkCKLkneXkJkakMdlu3VXErRNwEiWH-s/edit?usp=sharing,"Приехала мама, и опять начала лезть с упреками.","То ""это не прибрано"", то ""а зачем это здесь висит"", то ""почему у вас закрыта дверь, душно же"". Родители в деревне привыкли к открытым дверям: «Ветерок нужен». Но я плачу от укусов и ночных пробуждений. Проблему с мамой не решить - а вот с комарами можно! Подружка подсказала мне находку на Вайлдбериз, я заказала сразу. Делюсь!","Далее проводим распаковку продукта, показываем ключевые триггеры","Не мешает пользоваться дверью
Отлично держится даже на пластике
Можно стирать вручную
Совместима с москитными окнами
Безопасна даже при ежедневном использовании",Артикул в описании — пусть семья отдыхает без укусов.
66,Татьяна,Сетка дверная,,https://docs.google.com/document/d/1-SPa3FfcHxgUkCKLkneXkJkakMdlu3VXErRNwEiWH-s/edit?usp=sharing,"Все говорят: дети должны помогать родителям! Ну, я и помогаю.","Летом приезжаю к родителям в деревню, слышу «ставь дверь открытой, свежо же. Но вместе со свежестью лезут комары, а я всё чешусь. Обычно помогала им по дому, и теперь решила разобраться с их проблемой с комарами - предложила установить находку. Мама подсказала мне находку на Вайлдбериз, и я заказала. Делюсь!","Далее проводим распаковку продукта, показываем ключевые триггеры","Можно установить без помощи
Легко хранить зимой
Не мешает пользоваться замком
Малозаметна
Прочная, не рвется от ветра",Артикул — в описании.
67,Татьяна,Сетка дверная,,https://docs.google.com/document/d/1-SPa3FfcHxgUkCKLkneXkJkakMdlu3VXErRNwEiWH-s/edit?usp=sharing,КТо должен решать проблему в доме - жена или муж? Вы как считаете?,"В деревне я вожу машину, а муж готовит обеды. Ответственность за дом переходит ко мне: кто защитит уют, если не я? Я устала слышать споры о ролях, когда есть настоящая проблема — комары, которые влетают через открытую дверь. Рассказала соседке, соседка пошла в райцентр, глава раййцентра к соседу, тот к подруге - и она подсказала мне находку на Вайлдбериз, которую я сразу же заказала.","Далее проводим распаковку продукта, показываем ключевые триггеры","Сохраняет прохладу в жару
Быстрая доставка и установка
Никакого клея
Удобна для всей семьи
Экономит электроэнергию (меньше кондиционера)","Чтобы не искать сетку так долго, как я - забирайте артикул в описании!"
68,Татьяна,Сетка дверная,,https://docs.google.com/document/d/1-SPa3FfcHxgUkCKLkneXkJkakMdlu3VXErRNwEiWH-s/edit?usp=sharing,"Знали, что муж тоже может уйти в декретный отпуск? Во многих европейских странах это даже часто практикуется","У нас муж взял декрет, он теперь постоянно играет с ребёнком на веранде. Ну а я работаю, занимаюсь домом, слежу за огородом. Я хочу оставлять дверь открытой, чтобы проветрить после работы по дому. Но комары лезут внутрь, и муж вернётся расчесанным. Долго просила мужа решить проблему, но он занят ребенком, я это понимаю. Рассказала подруге, и та подсказала мне находку на Вайлдбериз, и я сразу её заказала. Делюсь!","Далее проводим распаковку продукта, показываем ключевые триггеры","Надежна даже в дождливую погоду
Не нуждается в специальном уходе
Сохраняет эстетичность
Не требует перетяжки
Прочная структура",Артикул в описании — и пусть муж сидит в декрете!
69,Татьяна,Сетка дверная,,https://docs.google.com/document/d/1-SPa3FfcHxgUkCKLkneXkJkakMdlu3VXErRNwEiWH-s/edit?usp=sharing,"Считаете, что домашние дела - это не работа? Как бы не так!","Многие в деревне считают, что моя работа по дому  - это такая же важная работа, как и любая другая. И я согласна - пока сделаешь все дела, так упашешься! Но стоит открыть дверь после уборки, проветрить — и комары портят весь труд: разбрасывают вещи, мусорят, кидают повсюду окурки. Я  нашла выход: соседка подсказала находку на Вайлдбериз, чтобы не пускать комаров в дом - и я заказала сразу. Делюсь!","Далее проводим распаковку продукта, показываем ключевые триггеры","Подходит для деревянных дверей
Открывается даже детьми
Никаких сложных инструкций
Отличный подарок для дачи
Совмещает практичность и стиль",Артикул — в описании. Проветривайте и спите спокойно.
70,Татьяна,Сетка дверная,,https://docs.google.com/document/d/1-SPa3FfcHxgUkCKLkneXkJkakMdlu3VXErRNwEiWH-s/edit?usp=sharing,"Я уехаала в деревню, потому что устала от работодателей с их постоянными редфлагами.","Не понимаю, почему им постоянно необходима, чтобы люди упахивались, перерабатывали, и желательно за маленькую зарплату? Я работаю удалённо из дома в деревне: связь то ловит, то нет. Когда отдыхаю после проекта, открываю дверь — и комары атакуют. Это больший стресс, чем рабочие дедлайны. Подруга подсказала мне находку на Вайлдбериз, и я заказала немедленно. Делюсь!","Далее проводим распаковку продукта, показываем ключевые триггеры","Идеальна для летнего сезона
Быстрое крепление
Работает без шума
Не загромождает пространство
Надежная в течение всего лета",Артикул — в описании. Проветривайте днем и ночью без укусов.
71,Татьяна,Сетка дверная,,https://docs.google.com/document/d/1-SPa3FfcHxgUkCKLkneXkJkakMdlu3VXErRNwEiWH-s/edit?usp=sharing,"У нас в деревне все друг другу доверяют, и до сих пор оставляют двери открытыми даже на ночь.","Это удобно, потому что так можно впускать холодный воздух с улицы. Мы называем это ""проветриванием"". Но летом комары проникают через открытую дверь, и никто не может спокойно отдыхать. Доходило до того, что всей деревней ходили и постоянно чесались от их укусов, пока самый первый парень на деревне, Семёны, не нашел на вайлдбериз эту находку, которая всех спасла. Делюсь!",,"Эстетика + функциональность
Не допускает перегрева помещения
Можно сочетать с шторами
Пропускает свет и воздух
Не вызывает перегрузки двери",Теперь делюсь артикулом с вами в описании - не потеряйте!
72,Татьяна,Сетка дверная,,https://docs.google.com/document/d/1-SPa3FfcHxgUkCKLkneXkJkakMdlu3VXErRNwEiWH-s/edit?usp=sharing,Декрет — не работа? Как бы не так!,"Когда я в декрете, ухаживаю за малышом днём и сплю короткими снами ночью. Выматываюсь, а еще получаю декретные - по всем признакам это работа! Хочу отдохнуть, открываю дверь на проветривание — и все ладошки в укусах! Сыну полгода, говорит мне «просто закрой дверь», а как жить без свежего воздуха? Тогда он подсказал мне находку на Вайлдбериз, и я сразу заказала. Делюсь!","Далее проводим распаковку продукта, показываем ключевые триггеры","Надежная защита от комаров
Простая установка без инструментов
Свободный проход свежего воздуха
Современный эстетичный дизайн
Безопасность для детей и питомцев",Дом теперь под защитой. В описании оставила артикул - сохраните!
73,Татьяна,Сетка дверная,,https://docs.google.com/document/d/1-SPa3FfcHxgUkCKLkneXkJkakMdlu3VXErRNwEiWH-s/edit?usp=sharing,Кто жживет только работой - тот пустышка. Как много я слышала это в городе!,"И тогда Я уехала в деревню после офисов, теперь работаю удалённо. Бывшие коллеги теперь говорят, что я «просто домохозяйка». И я решила вообще не загоняться по поводу этих ярлыков, мне важен результат: спокойный сон и свежий воздух. Рой комаров через открытую дверь этому иногда решает, и после города я не знала, что с этим сделать. Но как только познакомилась с соседями, они подсказали мне находку на Вайлдбериз, и я заказала. Делюсь!","Далее проводим распаковку продукта, показываем ключевые триггеры","Подходит для любых дверей
Не мешает дневному свету
Защищает даже ночью
Удобна в поездках и на пикнике
Не требует ухода",Артикул оставила для пвас в описании!
